Game Title,Brief Description,Price (USD),Genre,Platform,Release Year,Age Rating,Multiplayer,Developer
Stellar Empires: Rebirth,"A massive 4X strategy game where you explore, expand, exploit, and exterminate across a procedurally generated galaxy. Manage diplomacy, research, and fleet combat.",39.99,4X Strategy,PC,2024,E10+,No,Starforge Studios
Cyberdrift 2077,"An open-world action RPG set in a dystopian future city. Features deep character customization, branching storylines, and fast-paced cybernetic combat.",59.99,Action RPG,PC/Console,2023,M,No,NeonEdge Interactive
The Last Relic,"A challenging 2D platformer with rogue-like elements. Race through ancient ruins, discover powerful artifacts, and face off against formidable bosses.",19.99,Roguelike Platformer,PC/Switch,2022,T,No,CrystalByte Games
Pixel Farm Tycoon,"A relaxing simulation game where you build and manage your own profitable farm. Plant crops, raise livestock, and interact with the local community.",14.99,Farming Simulator,PC/Mobile,2021,E,No,SunnySeed Studios
Deep Space Defender (VR),"An immersive virtual reality rail shooter. Pilot a starfighter and defend the solar system from alien invaders. Intense, arcade-style action.",29.99,VR Shooter,VR,2024,T,No,VoidTech VR
Echoes of the Void,"A free-to-play competitive 5v5 online battle arena (MOBA). Choose your hero and team up to destroy the enemy nexus.",0.00,MOBA,PC,2020,T,Yes,TitanForge Entertainment
